qid,query
524332,treating tension headaches without medication
524447,treatment of varicose veins in legs
1048917,what is operating system misconfiguration
786937,what is process improvement lean six sigma
1049221,who recorded the song still the one
787255,what is project charter in project management
1049456,what is nortriptyline prescribed for
1049774,cost of attendance eastern illinois university
787784,what is provocative allergy testing
263670,how long is flight from hyd to dubai
1050253,who sang the song i had the time of my life
526331,types of anti depression medication
2235,bethel university was founded in what year
264410,how long is recovery from hemorrhoid banding
1050923,what is milk thistle useful in treating
830531,what is the maximum yearly retirement contributions
1051108,what is methylphenidate generic for
264827,how long is the flight from chicago to cairo
1051285,what is medicine acyclovir used for
1051307,what is medical term for neck fusion
1051352,what is mechanical advantages in science terms
1051475,what is mca and get weekly paychecks fake
2962,explain what a bone scan is and what it is used for
1051571,what is marilyn manson music called
961705,when was the little prince book lished
1038859,what is the goddess of agriculture in greek mythology
838116,what is the origin of the word punk
1052948,who unified italy mazzini garibaldi or cavour
266760,how long should i boil corn on the cob
1053253,what is institutional discrimination
267012,how long should i wait to handle my ball python after feeding
568841,what are the differences with winter and summer
267341,how long should you allow a calf to nurse
1053992,who was first u s president to resign from office
267566,how long should you rinse your eyes in a safety eye wash
791916,what is risk management give example
568895,what are the different kinds of arthritis
267644,how long should you wait in a walk in
1054186,what is hdl is that good or bad cholesterol
529918,types of standards for frequency generators
1054451,what is green information technology
5925,sony ps lx300usb how to connect to pc
6217,the hormone that does the opposite of calcitonin is
1091337,price per month for hackett security
1054958,what is freeroll in poker tournaments
1054969,what is freddie mac first look initiative
531142,typing average words per minute test
1055717,what is epic database for healthcare
1215,3 levels of government in canada and their responsibilities
307118,how much do rear brakes and rotors cost
1056303,what is doxycycline hyclate used for treating
166111,does excessive spinach consumption cause kidney stones
1056482,who was the last confederate soldier to surrender
7968,when did the earthquake hit san francisco during the world series
270140,how long to cook sauerkraut and fresh kielbasa in slow cooker
1056644,what is diflorasone diacetate cream used for
1100134,are life insurance policies protected information
1056950,who was the woman who sang in wicked rent
270520,how long to fast before stress test
1057015,what is deck over on gooseneck trailers
1057251,who were george washington s parents
88831,causes of trigger finger in children
8714,is the name used to refer to the era of legalized segregation in the united states
8854,disparity refers to the slightly different view of the world that each eye receives
1057539,what is crime rate for new port richey fl
569473,what are the effects of sediment transport
9083,is considered the father of modern medicine
569507,what are the eight steps of the troop leading process
9454,a simple definition for the word bias
1058036,what is considered human service experience
831784,what is the meaning of the root shared by the words project and eject weegy
569674,what are the factors in a marketing mix
10276,access how to go to most recent record
1058885,what is causing the constant dry heaving and nausea
272500,how long to wait between perm and color
1059045,what is cameroon most important resource
272815,how long until boiled eggs are done
273014,how long until you see gains from test e
11006,actress who plays alice on the magicians
11050,actress who turned down pretty woman ghost
273481,how long will food last in the refrigerator without power
273522,how long will heroin be detected in a urine test
176677,during pregnancy when does the baby get in the head down position
1094191,is common law marriage legal in what states
798253,what is southwest airlines baggage policy
1094249,is a type of information system that supports a specific functional area in the organization such as accounting human resources or operations
11913,advanced aerospace engineering salary
274067,how lubrication proximity switch work
1060566,community bank bristow routing number
1060616,why are junction mounts needed for cameras
1006922,which chromosome controls sex characteristics
570023,what are the four most commonly used metric prefixes
1060868,what is average roi for advertising
1060881,what is average pay for a warrant officer
45757,average temperatures des moines iowa
798883,what is spoofing in the context of it
570068,what are the four steps in the machine cycle
1061210,what is assisted reproductive technology cdc
12741,age and weight requirements for children to sit in the front seat
274981,how many atp does glycolysis produce
12903,age discrimination in the workplace cases
275049,how many awards did walt disney receive
275137,how many babies in a chipmunk birth
537301,virginia corporate income tax due date
308032,how much do you get paid at build a bear
275355,how many best western points for free night
275528,how many books did l ron hubbard write
13397,age not to take off shoes at airline security
537761,vitamin d deficiency and skin lesions
275629,how many brain cells do you have as a baby
1062350,what is an oxidation number used for
275997,how many calories are in a slice of ham
1062457,why did franklin d roosevelt launch a new programs during his first hundred days in office
1062511,what is an office administrative assistant salary in alabama
838453,what is the parent company for adidas
1062603,why did italy attack ethiopia in 1935
1094605,in chemical form what do subscripts tell you
538340,voluntary paternity establishment florida
276208,how many calories burn during swimming
276298,how many calories do i burn to lose weight
276329,how many calories do strawberry jello have
276338,how many calories do you burn by dancing
276348,how many calories do you burn during one hour of bodypump
1062961,what is an example of insight thinking
471850,parkinson s disease symptoms depression
818798,what is the difference in a c corp or s corp
1063371,what is an aviation medical examiner
276979,how many calories in a medium smoothie king smoothie
15063,alabama central credit union routing number
1063659,why did the supreme court expand the incorporation of the bill of rights
1063892,colorado routing number loveland colorado
539648,was amelia earhart alone when she crashed
15382,aldridge pite melville ny telephone number
801907,what is table associated for draw originals in sap
277623,how many calories in one fried oyster
277632,how many calories in one large baked potato
1007473,sediments originate from elements in seawater that precipitate out of solution
277701,how many calories in publix chicken tender subway
15607,all of the following were created by the first congress in 1789
277785,how many calories in tbsp of butter
277799,how many calories in tomatillo sauce
277977,how many calories mcdonalds chicken nuggets
278074,how many calories should be consumed at each meal
832790,what is the minimum area needed for a full bathroom
540306,was killed in the philippines but his ships were the first to circumnavigate the globe
253678,how long does it take for collections to come off credit report
1064852,why do i need short term disability insurance
278429,how many carbs can a type 2 diabetic have per day
278658,how many carbs in one cup of cooked quinoa
1065160,what is a wrongful act for directors and officers
540906,was the great wall of china breached
1065227,why do neptune and uranus appear blue
278863,how many career games did paul krause play in the nfl
1095059,average temperatures santa monica ca march
803237,what is terminal velocity for humans
